<?xml version="1.0" encoding="UTF-8"?>
<!--
  ~ Copyright (C) 2005-2015 Schlichtherle IT Services.
  ~ All rights reserved. Use is subject to license terms.
  -->
<archetypeProperties
        xmlns="${project.url}/xml/archetypeProperties"
        xmlns:xsi="http://www.w3.org/2001/XMLSchema-instance"
        xsi:schemaLocation="${project.url}/xml/archetypeProperties ../archetypeProperties.xsd">
    <artifactId>freeTrialPeriod</artifactId>
    <companyName>Company Inc.</companyName>
    <defaultPassword>test1234</defaultPassword>
    <freeTrialPeriod>30</freeTrialPeriod>
    <ftpSecretMarkerClass>sun.security.provider.Sun</ftpSecretMarkerClass>
    <groupId>com.company.product</groupId>
    <licensingSubject>Product 1</licensingSubject>
    <version>1.0-SNAPSHOT</version>
</archetypeProperties>
