<?xml version="1.0" encoding="UTF-8"?>
<!--
  ~ Copyright (C) 2005-2015 Schlichtherle IT Services.
  ~ All rights reserved. Use is subject to license terms.
  -->
<archetypeProperties
        xmlns="${project.url}/xmlns/archetypeProperties"
        xmlns:xsi="http://www.w3.org/2001/XMLSchema-instance"
        xsi:schemaLocation="${project.url}/xmlns/archetypeProperties ../archetypeProperties.xsd">
    <artifactId>customClock</artifactId>
    <companyName>Company Inc.</companyName>
    <defaultPassword>test1234</defaultPassword>
    <groupId>com.company.product</groupId>
    <keyMgrClockClass>com.company.product.keymgr.Main$SystemClock
    </keyMgrClockClass>
    <licensingSubject>Product 1</licensingSubject>
    <version>1.0-SNAPSHOT</version>
</archetypeProperties>
